clean_text,label_encoded
lt get me one of those and maybe next time,4
i often have the urge to say hi to people that i recognize from somewhere but they really dont know me either it was in a big group or maybe ive just seen them so many times in passing that i feel like i should know them and be friendly when i do i get weird looks like who in the world are you,7
i feel still so unloved alone and worse than anybody else,6
i feel greedy with my thoughts and it is a relief to let them linger,8
i unexpectedly met a girl with whom i have always got along well  i had not seen her for several months,4
look for it yourself  please  kinda busy here  daniel,0
i was actually on time to school today,10
i was pretty good at sipping at the water but my left quad was feeling funny around the half way point,3
im not feeling discouraged either,0
im feeling helpless if only there was a way to bypass their concerns,9
the more towards the past u carry in ya heartd less capable you are of loving in ya ning pals,0
thank you so much,4
i feel a little bit funny about the idea of a ship based on legitimate subtext and chemistry being lumped into the same group as total crack,3
i encourage you to discuss any bothersome paroxysmal symptoms you have with your ms professional and feel reassured that you are not going crazy,0
first night of break and im working,10
i could feel his eye twitch in annoyance he hated when humans got snippy with him,5
ill try it again when im feeling less emotional or maybe limit application to mount yeast ball when it makes yet another fabulous appearance on the right side of my chin,7
thankfully that face only shows up for photoshoots,8
i am not allowed to ink my skin and i was feeling a little rebellious i finally used my dusty eyeliner for something functional,3
brother provoked anger it was when mother and father were away and we had to look after ourselves he accused me of being selfish and a snob,0
i had loved someone though he didn t love me back and all the experiences had all ended with me feeling humiliated and worthless because the affection wasn t returned,6
is addicted to the pet society app on facebook,3
haha so my  little cousin didnt know we are celebrating their birthday today,10
quotyeah them men love them blowjobsquot something you never want to hear your grandma say over breakfast talkin about charles barkley,10
im not angry i just want to be able to feel valued appreciated and wanted,0
i continued to labor in the tub and then started to feel really uncomfortable,8
its getting really windy out there,9
i step into the vatican basilica with its austere stone and enormous size i instantly feel intimidated,7
i think she looks beautiful in her new designer glasses there may be times when she could feel more confident without them,7
aww how cute youd love my bathroom,3
i am very impressed with this product my skin feels radiant and has restored my love for facial exfoliators,6
i want him to be happy even that means i will never be able to feel his gentle touch ever again and i will crave with the need of it for the rest of my life,4
i know what i am feeling inside sad,9
i was completely overwhelmed really and they made me feel so special and loved i am honoured to be surrounded by such wonderful women,6
i feel only when i pick up the camera and press the shutter will i feel assured,7
i smile and feel hateful towards people who gawk at me and say stupid shit,5
im feeling in the mood to go fishing with this hot weather im thinking late october,7
i have already cried and got angry and feeling resentful at sathsang,0
i think and feel i am a sincere woman therefore my imaginations about love seem naive probably,6
is skyping with family,8
i will trust god fill the prescription take the pill when i feel overwhelmed by anxiety giving me an advantage so that i can overcome my anxiety handicap then i can continue to trust and find peace in his presence,9
im glad that part of it is over but i cant help feeling a remorseful nauseated feeling,7
ive experienced going to bed with a good night text from you and woke up the next day feeling like im contented with life,4
he even telephoned wexford to tell him about it  his elation subsiding somewhat when he heard the chief inspector had also found this out three hours before,4
the only thing i could think of during training was quotahh my teeth hurtquot cold warm amp wind hurts so on my way to the dentist,9
goin to bed wsmokey,1
i feel so funny today,3
i hate the way after hours of searching for something i always seem to leave feeling dissatisfied,5
i feel dumb but happy,4
i would give anything to stop feeling loyal enough so i could finally feel some real release,8
my previous tweet was a lie by,10
im dreading getting back to real life ltlt me too,9
i first began to feel one gracious sensation,7
i want to stand up and speak out so hopefully people like me can stop hiding who they are stop being afraid and just be happy and feel accepted she said,4
dont be fooled by my beautiful face i am a raging beast,0
youtube not working,9
i make this blog post i am feeling the melancholy running through my veins,9
lunch sucked ran out of time didnt get anything done,9
i know she feels helpless but that kiss that cuddle the hug every morning and the love you every night,6
i love to dance but often feel inhibited by my own body unsure what i am capable of hyper concerned about other people watching me and having opinions on my style or just feeling awkward as if i have no idea what i am supposed to do here,9
ive got some key tips to help you focus on avoiding feeling like a neurotic imposter and moving yourself to being a deserving confident individual how much better does that sound,1
i guess life is all about feeling discontent with people and situations you have absolutley no control over,4
i feel posting to r funny,3
i feel i wholeheartedly feel comfortable in,8
id been feeling very discouraged,0
im in fat burning stage is that when im not around a food source at my meal times i can go much longer without food without having the empty stomach shakes the feeling of my stomach growling empty and unhappy and without the energy crashes or that a href http www,1
im sure the turns are fun but im feeling greedy now that the end of ski season is starting to creep into sight,3
i feel like im too eager,2
im not proud but os x excels at videophoto editing where the pc lags so much behind,9
i hate being discombobulated and feeling useless,5
i love lucy coined term meaning not really sick but just feeling lousy,6
i feel hated since observers say people on the team really hate me i said that prayer today,5
i do feel a bit apprehensive with starting it as its technically my first although its slightly imperfect so im going to try not to worry about messing it up,9
i finish reading a novel i can feel anything from distressed to elated and i certainly need a few minutes for my thoughts please dont ask me if i spotted some ai words in there,8
ive tried to sign in back my myspace account for many times unfortunately it is not working,9
i think feeling hated by people is an adrenaline rush for me,5
i still love that feeling of just going surfing and i am keen to win a world title but i ll just take it as it comes said the father of three who adores his kids and pays huge compliments to his supportive wife monica,6
i feel i should be doing more to help and support them even though theres not much that i can actually do other than lend a sympathetic ear and give words of encouragement,0
i have always done as i really hate the feeling that someone doesnt want to be around me or is irritated by something ive done,5
i did that and posted a video on youtube there probably would be three outcomes either everyone would laugh and i feel ashamed of the video or have tons of views on my video and be famous or go about unnoticed by people,7
time for a bro rt  toilet leak sorted this weekend,4
i was younger or really up until this point in my life i never really understood what it was like to feel unhappy,4
i get excited to go to wal mart maybe dollar tree if im feeling dangerous,2
ok i mean this with no disrespect fuck that,1
getting ready to lay out by the pool,4
waiting out a car nap because sleep is just that rare this week wtf,10
so sad that schools have to close,9
i feel this way because i was sexually abused and i felt like i was his pride and joy only to find out later in life that i was one of dozens scores of boys who were told the same thing,4
i feel like i have been neglecting all my lovely readers the last couple of weeks,6
i know you feel disheartened when i am not excited about being with you but what can i say,2
i don t want to feel like it feels like we re not supporting it,7
i just want you to know no one wants to feel like they are nothing no one wants to feel unloved no one wants to feel pain every single day so f k off,6
i can see and feel radiant sunlight warming my body sending comfort and solace deep into my heart,8
the voice of nemo turns  today thanks npr,4
looks like a bed day for ol tomorrow,4
dont be worried im safe and sound lt you,4
i am grateful for being able to feel the gentle breeze of a warm afternoon and the love of a sweet embrace,6
i understand some people are more comfortable sharing in that way because they don t feel pressured to make eye contact sometimes i found myself later in the week wondering which story went with what person,8
i feel especially strongly about this since i have hated my teeth forever i,5
i hate seeing you sick and i feel so bad you are sick especially since you caught the cold from me i figured this would happen at some point i mean we do spend every day all day long together,5
